[
  {
    "id": "important-emails",
    "name": "Mark Important Emails",
    "condition": {
      "type": "or",
      "conditions": [
        {
          "type": "headerContains",
          "name": "subject",
          "substring": "URGENT"
        },
        {
          "type": "headerContains",
          "name": "subject", 
          "substring": "IMPORTANT"
        },
        {
          "type": "headerEquals",
          "name": "x-priority",
          "value": "1"
        }
      ]
    },
    "actions": [
      {
        "type": "addLabel",
        "value": "important"
      },
      {
        "type": "setPriority",
        "value": 9
      }
    ],
    "priority": 100,
    "enabled": true
  },
  {
    "id": "newsletters-and-news",
    "name": "Newsletter and News Detection",
    "condition": {
      "type": "or",
      "conditions": [
        {
          "type": "headerContains",
          "name": "from",
          "substring": "newsletter"
        },
        {
          "type": "headerContains",
          "name": "from",
          "substring": "noreply"
        },
        {
          "type": "headerContains",
          "name": "subject",
          "substring": "newsletter"
        },
        {
          "type": "headerContains",
          "name": "subject",
          "substring": "weekly update"
        },
        {
          "type": "headerContains",
          "name": "list-unsubscribe",
          "substring": "http"
        }
      ]
    },
    "actions": [
      {
        "type": "addLabel",
        "value": "news"
      }
    ],
    "priority": 50,
    "enabled": true
  },
  {
    "id": "legal-documents",
    "name": "Legal and Compliance Emails",
    "condition": {
      "type": "or",
      "conditions": [
        {
          "type": "headerContains",
          "name": "subject",
          "substring": "terms of service"
        },
        {
          "type": "headerContains",
          "name": "subject",
          "substring": "privacy policy"
        },
        {
          "type": "headerContains",
          "name": "subject",
          "substring": "legal notice"
        },
        {
          "type": "headerContains",
          "name": "subject",
          "substring": "compliance"
        },
        {
          "type": "headerContains",
          "name": "from",
          "substring": "legal@"
        },
        {
          "type": "headerContains",
          "name": "subject",
          "substring": "DMCA"
        }
      ]
    },
    "actions": [
      {
        "type": "addLabel",
        "value": "legal"
      }
    ],
    "priority": 70,
    "enabled": true
  },
  {
    "id": "authentication-security",
    "name": "Authentication and Security",
    "condition": {
      "type": "or",
      "conditions": [
        {
          "type": "headerContains",
          "name": "subject",
          "substring": "two-factor"
        },
        {
          "type": "headerContains",
          "name": "subject",
          "substring": "2fa"
        },
        {
          "type": "headerContains",
          "name": "subject",
          "substring": "login attempt"
        },
        {
          "type": "headerContains",
          "name": "subject",
          "substring": "verification code"
        },
        {
          "type": "headerContains",
          "name": "subject",
          "substring": "security alert"
        },
        {
          "type": "headerContains",
          "name": "from",
          "substring": "security@"
        }
      ]
    },
    "actions": [
      {
        "type": "addLabel",
        "value": "authentication"
      },
      {
        "type": "setPriority",
        "value": 8
      }
    ],
    "priority": 90,
    "enabled": true
  },
  {
    "id": "security-compromises",
    "name": "Security Compromises and Breaches",
    "condition": {
      "type": "or",
      "conditions": [
        {
          "type": "headerContains",
          "name": "subject",
          "substring": "security breach"
        },
        {
          "type": "headerContains",
          "name": "subject",
          "substring": "data breach"
        },
        {
          "type": "headerContains",
          "name": "subject",
          "substring": "account compromised"
        },
        {
          "type": "headerContains",
          "name": "subject",
          "substring": "suspicious activity"
        },
        {
          "type": "headerContains",
          "name": "subject",
          "substring": "password changed"
        }
      ]
    },
    "actions": [
      {
        "type": "addLabel",
        "value": "compromises"
      },
      {
        "type": "setPriority",
        "value": 10
      }
    ],
    "priority": 95,
    "enabled": true
  },
  {
    "id": "receipts-purchases",
    "name": "Purchase Receipts and Invoices",
    "condition": {
      "type": "or",
      "conditions": [
        {
          "type": "headerContains",
          "name": "subject",
          "substring": "receipt"
        },
        {
          "type": "headerContains",
          "name": "subject",
          "substring": "invoice"
        },
        {
          "type": "headerContains",
          "name": "subject",
          "substring": "payment confirmation"
        },
        {
          "type": "headerContains",
          "name": "subject",
          "substring": "purchase confirmation"
        },
        {
          "type": "headerContains",
          "name": "from",
          "substring": "receipts@"
        },
        {
          "type": "headerContains",
          "name": "from",
          "substring": "billing@"
        }
      ]
    },
    "actions": [
      {
        "type": "addLabel",
        "value": "receipts"
      }
    ],
    "priority": 60,
    "enabled": true
  },
  {
    "id": "shipping-delivery",
    "name": "Shipping and Delivery Updates",
    "condition": {
      "type": "or",
      "conditions": [
        {
          "type": "headerContains",
          "name": "subject",
          "substring": "shipped"
        },
        {
          "type": "headerContains",
          "name": "subject",
          "substring": "tracking"
        },
        {
          "type": "headerContains",
          "name": "subject",
          "substring": "delivery"
        },
        {
          "type": "headerContains",
          "name": "subject",
          "substring": "package"
        },
        {
          "type": "headerContains",
          "name": "from",
          "substring": "fedex"
        },
        {
          "type": "headerContains",
          "name": "from",
          "substring": "ups"
        },
        {
          "type": "headerContains",
          "name": "from",
          "substring": "dhl"
        }
      ]
    },
    "actions": [
      {
        "type": "addLabel",
        "value": "shipping"
      }
    ],
    "priority": 40,
    "enabled": true
  },
  {
    "id": "calendar-invites",
    "name": "Calendar Invitations",
    "condition": {
      "type": "or",
      "conditions": [
        {
          "type": "headerContains",
          "name": "content-type",
          "substring": "text/calendar"
        },
        {
          "type": "headerContains",
          "name": "subject",
          "substring": "invitation"
        },
        {
          "type": "headerContains",
          "name": "subject",
          "substring": "meeting request"
        },
        {
          "type": "headerContains",
          "name": "subject",
          "substring": "calendar"
        },
        {
          "type": "headerEquals",
          "name": "method",
          "value": "REQUEST"
        }
      ]
    },
    "actions": [
      {
        "type": "addLabel",
        "value": "calendar-invites"
      },
      {
        "type": "setPriority",
        "value": 7
      }
    ],
    "priority": 80,
    "enabled": true
  },
  {
    "id": "meeting-notes",
    "name": "Meeting Notes and Summaries",
    "condition": {
      "type": "or",
      "conditions": [
        {
          "type": "headerContains",
          "name": "subject",
          "substring": "meeting notes"
        },
        {
          "type": "headerContains",
          "name": "subject",
          "substring": "meeting summary"
        },
        {
          "type": "headerContains",
          "name": "subject",
          "substring": "action items"
        },
        {
          "type": "headerContains",
          "name": "subject",
          "substring": "meeting minutes"
        },
        {
          "type": "headerContains",
          "name": "from",
          "substring": "zoom"
        },
        {
          "type": "headerContains",
          "name": "from",
          "substring": "teams"
        }
      ]
    },
    "actions": [
      {
        "type": "addLabel",
        "value": "meeting-notes"
      }
    ],
    "priority": 65,
    "enabled": true
  },
  {
    "id": "junk-spam",
    "name": "Junk and Spam Detection",
    "condition": {
      "type": "or",
      "conditions": [
        {
          "type": "headerContains",
          "name": "subject",
          "substring": "make money fast"
        },
        {
          "type": "headerContains",
          "name": "subject",
          "substring": "click here"
        },
        {
          "type": "headerContains",
          "name": "subject",
          "substring": "congratulations"
        },
        {
          "type": "headerMatches",
          "name": "subject",
          "pattern": "^RE:.*RE:.*RE:"
        },
        {
          "type": "headerContains",
          "name": "from",
          "substring": "noreply@suspicious"
        },
        {
          "type": "not",
          "condition": {
            "type": "headerContains",
            "name": "received",
            "substring": "trusted-domain.com"
          }
        }
      ]
    },
    "actions": [
      {
        "type": "addLabel",
        "value": "junk"
      },
      {
        "type": "setPriority",